{
  "schema_version": "1.0",
  "source_key": "tx-dallas-pre_foreclosure",
  "run_id": "00000000-0000-4000-8000-000000000001",
  "scheduled_for": "2026-10-12",
  "pulled_at": "2026-10-12T05:01:00-05:00",
  "source": {
    "state": "TX",
    "county": "Dallas",
    "jurisdiction": "Dallas County",
    "list_type": "pre_foreclosure",
    "source_url": "https://www.dallascounty.org/government/county-clerk/recording/foreclosures.php"
  },
  "status": "success",
  "status_reason": "",
  "lookback_days": 30,
  "window_start": "2026-09-13",
  "window_end": "2026-10-12",
  "coverage_complete": true,
  "source_as_of": "2026-10-12",
  "records_sha256": "1bbafec8abb0d8dce25029f4d54ab857118b57a0ecaf10db47c931ffd5873eb6",
  "records": [
    {
      "source_record_id": "SYNTHETIC-TEST-NOT-A-REAL-CASE",
      "case_number": "TEST-001",
      "filed_date": "2026-10-09",
      "auction_date": "2026-11-03",
      "property_address": "1234 Example Avenue",
      "unit": null,
      "city": "Dallas",
      "state": "TX",
      "zip": "75201",
      "parcel_id": null,
      "owner_name": "Synthetic Test Owner",
      "mailing_address": null,
      "amount_owed": null,
      "amount_type": "unknown",
      "source_url": "https://www.dallascounty.org/government/county-clerk/recording/foreclosures.php",
      "raw": {
        "fixture": true
      }
    }
  ]
}
